{
  "dataset_id": "cnn_dailymail_dm200",
  "harness": "0.4.4",
  "items": {
    "kind": "text",
    "n": 200,
    "words": {
      "histogram": [
        [
          110,
          283,
          20
        ],
        [
          284,
          457,
          45
        ],
        [
          458,
          631,
          44
        ],
        [
          632,
          805,
          31
        ],
        [
          806,
          979,
          23
        ],
        [
          980,
          1153,
          19
        ],
        [
          1154,
          1327,
          6
        ],
        [
          1328,
          1501,
          3
        ],
        [
          1502,
          1675,
          4
        ],
        [
          1676,
          1849,
          5
        ]
      ],
      "max": 1844,
      "median": 605,
      "min": 110,
      "p25": 422,
      "p75": 859
    }
  },
  "items_sha256": "0cf85d1eb3b9176ac6e49f3ab83761e271aeb0f87b18709f230815a4e213865b",
  "made_at": "2026-10-28T22:19:43Z",
  "references": [
    {
      "id": "gold/cnn_dailymail_dm200",
      "items": 200,
      "shape": "text",
      "words": {
        "histogram": [
          [
            22,
            32,
            6
          ],
          [
            33,
            43,
            42
          ],
          [
            44,
            54,
            60
          ],
          [
            55,
            65,
            37
          ],
          [
            66,
            76,
            25
          ],
          [
            77,
            87,
            14
          ],
          [
            88,
            98,
            5
          ],
          [
            99,
            109,
            7
          ],
          [
            110,
            120,
            2
          ],
          [
            121,
            131,
            2
          ]
        ],
        "max": 130,
        "median": 54,
        "min": 22,
        "p25": 45,
        "p75": 67
      }
    }
  ],
  "rows": [
    {
      "item_id": "00bfcb9d07faa098e1f725594e884d0e221dc489",
      "reference": {
        "gold/cnn_dailymail_dm200": "42 words"
      },
      "source_url": "https://huggingface.co/datasets/abisee/cnn_dailymail/viewer/1.0.0/test?row=1903",
      "words": 523
    },
    {
      "item_id": "01205b429804a281ec89e3ce12dd75f6dad645e8",
      "reference": {
        "gold/cnn_dailymail_dm200": "41 words"
      },
      "source_url": "https://huggingface.co/datasets/abisee/cnn_dailymail/viewer/1.0.0/test?row=2690",
      "words": 330
    },
    {
      "item_id": "017738d8c5fcdc149495b528b4dd084875d3dfbf",
      "reference": {
        "gold/cnn_dailymail_dm200": "49 words"
      },
      "source_url": "https://huggingface.co/datasets/abisee/cnn_dailymail/viewer/1.0.0/test?row=1119",
      "words": 442
    },
    {
      "item_id": "051db32933d7721f2de9c99276787caebff3c996",
      "reference": {
        "gold/cnn_dailymail_dm200": "45 words"
      },
      "source_url": "https://huggingface.co/datasets/abisee/cnn_dailymail/viewer/1.0.0/test?row=3065",
      "words": 478
    },
    {
      "item_id": "0538c4e50be6b94cfe1c6d47fea0e6443616ebdd",
      "reference": {
        "gold/cnn_dailymail_dm200": "66 words"
      },
      "source_url": "https://huggingface.co/datasets/abisee/cnn_dailymail/viewer/1.0.0/test?row=7333",
      "words": 886
    },
    {
      "item_id": "070cff525ba5fff5dfe01fda50b43764a8143fc1",
      "reference": {
        "gold/cnn_dailymail_dm200": "101 words"
      },
      "source_url": "https://huggingface.co/datasets/abisee/cnn_dailymail/viewer/1.0.0/test?row=6173",
      "words": 679
    },
    {
      "item_id": "086d954213948fa187957bc981819b5c40fe1943",
      "reference": {
        "gold/cnn_dailymail_dm200": "54 words"
      },
      "source_url": "https://huggingface.co/datasets/abisee/cnn_dailymail/viewer/1.0.0/test?row=5032",
      "words": 531
    },
    {
      "item_id": "096dda15ca272deaf1dd92507249fe9d17188235",
      "reference": {
        "gold/cnn_dailymail_dm200": "78 words"
      },
      "source_url": "https://huggingface.co/datasets/abisee/cnn_dailymail/viewer/1.0.0/test?row=8421",
      "words": 670
    },
    {
      "item_id": "0a09b7008372d01e2fed5586961457a14a8f5a82",
      "reference": {
        "gold/cnn_dailymail_dm200": "80 words"
      },
      "source_url": "https://huggingface.co/datasets/abisee/cnn_dailymail/viewer/1.0.0/test?row=5626",
      "words": 1108
    },
    {
      "item_id": "0fa083cb7da10f1f697e7dab6210397f00c0a4cf",
      "reference": {
        "gold/cnn_dailymail_dm200": "83 words"
      },
      "source_url": "https://huggingface.co/datasets/abisee/cnn_dailymail/viewer/1.0.0/test?row=9514",
      "words": 341
    },
    {
      "item_id": "12893950047350a275fdee5ce4f9a8610e9236bb",
      "reference": {
        "gold/cnn_dailymail_dm200": "130 words"
      },
      "source_url": "https://huggingface.co/datasets/abisee/cnn_dailymail/viewer/1.0.0/test?row=5552",
      "words": 867
    },
    {
      "item_id": "14514f8448a1e8803ebcdea39e846326e1975d2a",
      "reference": {
        "gold/cnn_dailymail_dm200": "52 words"
      },
      "source_url": "https://huggingface.co/datasets/abisee/cnn_dailymail/viewer/1.0.0/test?row=3538",
      "words": 227
    },
    {
      "item_id": "18a5d47e83e935e37e38c149619751a1ac3eabd8",
      "reference": {
        "gold/cnn_dailymail_dm200": "42 words"
      },
      "source_url": "https://huggingface.co/datasets/abisee/cnn_dailymail/viewer/1.0.0/test?row=2340",
      "words": 259
    },
    {
      "item_id": "19d910abd29298f42076cd1e889c712d5fb01748",
      "reference": {
        "gold/cnn_dailymail_dm200": "84 words"
      },
      "source_url": "https://huggingface.co/datasets/abisee/cnn_dailymail/viewer/1.0.0/test?row=3584",
      "words": 1411
    },
    {
      "item_id": "1a343914e2435b71ba96e133da2d68d623c418e6",
      "reference": {
        "gold/cnn_dailymail_dm200": "39 words"
      },
      "source_url": "https://huggingface.co/datasets/abisee/cnn_dailymail/viewer/1.0.0/test?row=4602",
      "words": 420
    },
    {
      "item_id": "1bd44b6e16bf10fd453a0b2f2fcda8bd30cb4761",
      "reference": {
        "gold/cnn_dailymail_dm200": "81 words"
      },
      "source_url": "https://huggingface.co/datasets/abisee/cnn_dailymail/viewer/1.0.0/test?row=7234",
      "words": 1665
    },
    {
      "item_id": "1c69b5c1b2fb520bb153ebf54687ec16dfa133ca",
      "reference": {
        "gold/cnn_dailymail_dm200": "70 words"
      },
      "source_url": "https://huggingface.co/datasets/abisee/cnn_dailymail/viewer/1.0.0/test?row=11461",
      "words": 883
    },
    {
      "item_id": "1d965b7ef3e3aa66f4b55ca424496c3ff7307dcf",
      "reference": {
        "gold/cnn_dailymail_dm200": "61 words"
      },
      "source_url": "https://huggingface.co/datasets/abisee/cnn_dailymail/viewer/1.0.0/test?row=1233",
      "words": 281
    },
    {
      "item_id": "1ddc1d165b74f4afc1eab431b5d461522a60e841",
      "reference": {
        "gold/cnn_dailymail_dm200": "56 words"
      },
      "source_url": "https://huggingface.co/datasets/abisee/cnn_dailymail/viewer/1.0.0/test?row=4621",
      "words": 427
    },
    {
      "item_id": "1e717ed4d3b39cbf10280cdd38a1a4a987ec7d52",
      "reference": {
        "gold/cnn_dailymail_dm200": "34 words"
      },
      "source_url": "https://huggingface.co/datasets/abisee/cnn_dailymail/viewer/1.0.0/test?row=10631",
      "words": 809
    },
    {
      "item_id": "21030573ff6bfdee513380f10df25af64cf66a17",
      "reference": {
        "gold/cnn_dailymail_dm200": "90 words"
      },
      "source_url": "https://huggingface.co/datasets/abisee/cnn_dailymail/viewer/1.0.0/test?row=3953",
      "words": 893
    },
    {
      "item_id": "22224ab649ac7b24e34faca0650368602192f358",
      "reference": {
        "gold/cnn_dailymail_dm200": "52 words"
      },
      "source_url": "https://huggingface.co/datasets/abisee/cnn_dailymail/viewer/1.0.0/test?row=9093",
      "words": 1101
    },
    {
      "item_id": "225f2330a6477e05fd3cebb31d3c87243cd40eb6",
      "reference": {
        "gold/cnn_dailymail_dm200": "59 words"
      },
      "source_url": "https://huggingface.co/datasets/abisee/cnn_dailymail/viewer/1.0.0/test?row=1018",
      "words": 228
    },
    {
      "item_id": "226e8811bb8b12773895eeb43645726bb6447764",
      "reference": {
        "gold/cnn_dailymail_dm200": "64 words"
      },
      "source_url": "https://huggingface.co/datasets/abisee/cnn_dailymail/viewer/1.0.0/test?row=7690",
      "words": 852
    },
    {
      "item_id": "24f53c358c6776a9a25b9dcbd60b33ca7bae5675",
      "reference": {
        "gold/cnn_dailymail_dm200": "38 words"
      },
      "source_url": "https://huggingface.co/datasets/abisee/cnn_dailymail/viewer/1.0.0/test?row=3610",
      "words": 556
    },
    {
      "item_id": "289e33599f43dfd3bf62315b1ca87c05a0e47761",
      "reference": {
        "gold/cnn_dailymail_dm200": "54 words"
      },
      "source_url": "https://huggingface.co/datasets/abisee/cnn_dailymail/viewer/1.0.0/test?row=5627",
      "words": 866
    },
    {
      "item_id": "2aa60a7b1f027e29a048bc7191846e659686d464",
      "reference": {
        "gold/cnn_dailymail_dm200": "64 words"
      },
      "source_url": "https://huggingface.co/datasets/abisee/cnn_dailymail/viewer/1.0.0/test?row=4589",
      "words": 330
    },
    {
      "item_id": "2dfa0295b48249b24c373af7319a1b3ec027a549",
      "reference": {
        "gold/cnn_dailymail_dm200": "38 words"
      },
      "source_url": "https://huggingface.co/datasets/abisee/cnn_dailymail/viewer/1.0.0/test?row=6568",
      "words": 564
    },
    {
      "item_id": "2e2e6c66137501391427b4874d59e9dffff63274",
      "reference": {
        "gold/cnn_dailymail_dm200": "51 words"
      },
      "source_url": "https://huggingface.co/datasets/abisee/cnn_dailymail/viewer/1.0.0/test?row=4328",
      "words": 613
    },
    {